{
  "id": "hairstyle-wolf-cut",
  "slug": "wolf-cut",
  "name": "Wolf cut",
  "kind": "cut",
  "summary": "A heavily layered shag–mullet hybrid with shorter volume around the crown and face and more length retained toward the back.",
  "intro": [
    "The wolf cut combines the abundant layering and movement of a shag with some of the front-to-back length contrast associated with a mullet.",
    "There is no single fixed wolf-cut geometry. Softer versions blend the layers heavily, while more extreme versions use stronger disconnection between the crown, sides and retained back length."
  ],
  "variations": [
    {
      "id": "wolf-cut-curly",
      "name": "Curly wolf cut",
      "description": "Uses layered natural curls to create crown volume and a broader, more irregular outer silhouette."
    },
    {
      "id": "wolf-cut-medium",
      "name": "Medium wolf cut",
      "description": "A shoulder-area version with visible crown layering, face framing and longer layers through the back."
    },
    {
      "id": "wolf-cut-soft",
      "name": "Soft wolf cut",
      "description": "A more blended interpretation that sits closer to a shag, with less dramatic separation between short and long layers."
    }
  ],
  "consultation": {
    "intro": "The key consultation choice is how strongly the cut should lean toward shag versus mullet.",
    "questions": [
      "How much length should remain at the back?",
      "How short should the crown layers become?",
      "Should the layers blend softly or look deliberately disconnected?",
      "Do you want a fringe or face-framing pieces?",
      "Will the hair normally be worn in its natural texture or styled differently?"
    ],
    "sampleRequest": "“I’d like a medium wolf cut with lots of crown volume and face-framing layers, but keep the transition into the longer back fairly soft rather than giving me a strong mullet.”"
  },
  "considerations": [
    "The name covers a broad family of cuts, so reference images are especially important.",
    "Heavy layering removes weight and can expose differences in density more strongly than a one-length cut.",
    "Straight hair may need styling to emphasize the texture and separation that occur naturally in wavy or curly hair.",
    "Curly and coily hair can shrink substantially, so the intended dry silhouette and layer placement should be assessed in the natural state."
  ],
  "sourceIds": [
    "allure-wolf-cut-2026",
    "haircom-wolf-cut"
  ],
  "relatedStyleIds": [
    "hairstyle-long-layered-cut",
    "hairstyle-short-curly-shag",
    "hairstyle-short-feathered-shag"
  ],
  "guidePublicationStatus": "published"
}
