{
  "id": "hairstyle-sleek-long-cut",
  "slug": "sleek-long-cut",
  "name": "Sleek long cut",
  "kind": "cut",
  "summary": "A long, near-one-length cut with a dense clean perimeter and minimal visible layering, worn with a smooth straight finish that emphasizes length, shine, and an uninterrupted silhouette.",
  "intro": [
    "The sleek long cut keeps the hair distinctly long and visually continuous from roots to ends, with little or no visible graduation through the lengths. Its strongest identifying feature is a substantial, clean perimeter rather than the movement and stepped graduation of a long layered cut.",
    "Long, center-parted, poker-straight hair became an especially recognizable fashion image in the 1970s, with Cher's long straight black hair repeatedly cited as emblematic of the era. Contemporary versions retain that uninterrupted length but often push the finish toward greater smoothness and reflectivity.",
    "The haircut and the finish should be discussed separately: the underlying cut can be maintained as a one-length or nearly one-length shape, while the sleek appearance depends on the hair's natural pattern, drying method, smoothing technique, condition, and desired level of shine."
  ],
  "variations": [
    {
      "id": "sleek-long-cut-center-part",
      "name": "Center-part sleek long cut",
      "description": "Keeps a central part and an uninterrupted long silhouette, emphasizing symmetry and the clean perimeter."
    },
    {
      "id": "sleek-long-cut-liquid-finish",
      "name": "Liquid-finish sleek long cut",
      "description": "Uses a highly smooth, glossy finish with more fluid movement through the long lengths rather than the stiffer polished effect associated with short glass-hair looks."
    },
    {
      "id": "sleek-long-cut-soft-perimeter",
      "name": "Soft-perimeter sleek long cut",
      "description": "Retains the one-length visual impression but lightly softens or point-cuts the ends so the perimeter is less severe while still reading as dense and continuous."
    }
  ],
  "consultation": {
    "intro": "Agree on retained length, perimeter density, how strictly one-length the shape should remain, parting, and the amount of daily smoothing required to achieve the intended finish.",
    "questions": [
      "What finished length do you want to keep: chest, mid-back, waist, or longer?",
      "Should the bottom edge read as sharply blunt or slightly softened while still looking one-length?",
      "Do you want absolutely no visible layers, or only minimal invisible/internal weight removal?",
      "Will you usually wear a center part, side part, or switch between both?",
      "Do you want the sleek finish to follow your natural texture as closely as possible, or are you comfortable using blow-drying or heat-styling to make it straighter?"
    ],
    "sampleRequest": "“I want to keep the hair long and make it look sleek and dense, with a clean one-length perimeter and no visible face-framing or graduated layers. Keep the center part and soften the very ends only enough that the line does not look harsh.”"
  },
  "considerations": [
    "The dense perimeter is a defining part of the look. Removing too much weight or adding visible graduation can shift the result toward a long layered cut instead.",
    "A sleek finish is not produced by the haircut alone. Natural pattern, humidity, hair condition, blow-drying, heat styling, and finishing products all affect how straight and reflective the surface appears.",
    "Fine or lower-density hair can benefit visually from the strong one-length perimeter because the ends are not thinned by extensive layering.",
    "Very dense hair may feel heavy in a strict one-length shape; discreet internal weight removal can improve manageability, but it should not create obvious surface layers if the sleek uninterrupted silhouette is the goal.",
    "Frequent high-heat straightening can increase damage risk, so the desired finish and realistic maintenance routine should be discussed separately from the cut itself."
  ],
  "sourceIds": [
    "british-vogue-70s-summer-haircuts",
    "vogue-cher-hair-2014",
    "vogue-germany-liquid-hair",
    "vogue-india-volumising-haircuts-straight-hair"
  ],
  "relatedStyleIds": [
    "hairstyle-hime-cut",
    "hairstyle-long-layered-cut"
  ],
  "guidePublicationStatus": "published"
}
